[{"index":{"_index":"phototheque","_type":"phototheque","_id":"_9834050"}},{"id":447,"indexCIJW":"PH0314001002","dossier":"0314","sousdossier":"001","document":"002","lien":"y","photographe":"Luc PRISSET","agence":"ATD Quart-Monde","droit_auteur":"PHOATD","droit_image":"TACITE","contenu":"Fond L.P. ANGERS 1987  N+C","date":"1987-02-28T23:00:00.000Z","lieu":"Angers (France)","description":"jardin d'enfants","local":"---","support":"ANB_","dateMaj":"2017-08-13T22:00:00.000Z","redacteur":"PS","content":" 447 PH0314001002 0314 001 002 y Luc PRISSET ATD Quart-Monde PHOATD TACITE Fond L.P. ANGERS 1987  N+C Sun Mar 01 1987 00:00:00 GMT+0100 (Paris, Madrid) Angers (France) jardin d'enfants --- ANB_ Mon Aug 14 2017 00:00:00 GMT+0200 (Paris, Madrid (heure d’été)) PS"},{"index":{"_index":"phototheque","_type":"phototheque","_id":"_9834051"}},{"id":448,"indexCIJW":"PH0314001003","dossier":"0314","sousdossier":"001","document":"003","lien":"y","photographe":"Luc PRISSET","agence":"ATD Quart-Monde","droit_auteur":"PHOATD","droit_image":"TACITE","contenu":"Fond L.P. ANGERS 1987  N+C","date":"1987-02-28T23:00:00.000Z","lieu":"Angers (France)","description":"famille à identifier","local":"---","support":"ANB_","dateMaj":"2017-08-13T22:00:00.000Z","redacteur":"PS","content":" 448 PH0314001003 0314 001 003 y Luc PRISSET ATD Quart-Monde PHOATD TACITE Fond L.P. ANGERS 1987  N+C Sun Mar 01 1987 00:00:00 GMT+0100 (Paris, Madrid) Angers (France) famille à identifier --- ANB_ Mon Aug 14 2017 00:00:00 GMT+0200 (Paris, Madrid (heure d’été)) PS"},{"index":{"_index":"phototheque","_type":"phototheque","_id":"_9834052"}},{"id":449,"indexCIJW":"PH0314001004","dossier":"0314","sousdossier":"001","document":"004","lien":"y","photographe":"Luc PRISSET","agence":"ATD Quart-Monde","droit_auteur":"PHOATD","droit_image":"TACITE","contenu":"Fond L.P. ANGERS 1987  N+C","date":"1987-02-28T23:00:00.000Z","lieu":"Angers (France)","description":"famille à identifier","local":"---","support":"ANB_","dateMaj":"2017-08-13T22:00:00.000Z","redacteur":"PS","content":" 449 PH0314001004 0314 001 004 y Luc PRISSET ATD Quart-Monde PHOATD TACITE Fond L.P. ANGERS 1987  N+C Sun Mar 01 1987 00:00:00 GMT+0100 (Paris, Madrid) Angers (France) famille à identifier --- ANB_ Mon Aug 14 2017 00:00:00 GMT+0200 (Paris, Madrid (heure d’été)) PS"},{"index":{"_index":"phototheque","_type":"phototheque","_id":"_9834053"}},{"id":450,"indexCIJW":"PH0314001005","dossier":"0314","sousdossier":"001","document":"005","lien":"y","photographe":"Luc PRISSET","agence":"ATD Quart-Monde","droit_auteur":"PHOATD","droit_image":"TACITE","contenu":"Fond L.P. ANGERS 1987  N+C","date":"1987-02-28T23:00:00.000Z","lieu":"Angers (France)","description":"famille à identifier","local":"---","support":"ANB_","dateMaj":"2017-08-13T22:00:00.000Z","redacteur":"PS","content":" 450 PH0314001005 0314 001 005 y Luc PRISSET ATD Quart-Monde PHOATD TACITE Fond L.P. ANGERS 1987  N+C Sun Mar 01 1987 00:00:00 GMT+0100 (Paris, Madrid) Angers (France) famille à identifier --- ANB_ Mon Aug 14 2017 00:00:00 GMT+0200 (Paris, Madrid (heure d’été)) PS"},{"index":{"_index":"phototheque","_type":"phototheque","_id":"_9834054"}},{"id":451,"indexCIJW":"PH0314001006","dossier":"0314","sousdossier":"001","document":"006","lien":"y","photographe":"Luc PRISSET","agence":"ATD Quart-Monde","droit_auteur":"PHOATD","droit_image":"TACITE","contenu":"Fond L.P. ANGERS 1987  N+C","date":"1987-02-28T23:00:00.000Z","lieu":"Angers (France)","description":"famille à identifier","local":"---","support":"ANB_","dateMaj":"2017-08-13T22:00:00.000Z","redacteur":"PS","content":" 451 PH0314001006 0314 001 006 y Luc PRISSET ATD Quart-Monde PHOATD TACITE Fond L.P. ANGERS 1987  N+C Sun Mar 01 1987 00:00:00 GMT+0100 (Paris, Madrid) Angers (France) famille à identifier --- ANB_ Mon Aug 14 2017 00:00:00 GMT+0200 (Paris, Madrid (heure d’été)) PS"},{"index":{"_index":"phototheque","_type":"phototheque","_id":"_9834055"}},{"id":452,"indexCIJW":"PH0314001007","dossier":"0314","sousdossier":"001","document":"007","lien":"y","photographe":"Luc PRISSET","agence":"ATD Quart-Monde","droit_auteur":"PHOATD","droit_image":"TACITE","contenu":"Fond L.P. ANGERS 1987  N+C","date":"1987-02-28T23:00:00.000Z","lieu":"Angers (France)","description":"famille à identifier","local":"---","support":"ANB_","dateMaj":"2017-08-13T22:00:00.000Z","redacteur":"PS","content":" 452 PH0314001007 0314 001 007 y Luc PRISSET ATD Quart-Monde PHOATD TACITE Fond L.P. ANGERS 1987  N+C Sun Mar 01 1987 00:00:00 GMT+0100 (Paris, Madrid) Angers (France) famille à identifier --- ANB_ Mon Aug 14 2017 00:00:00 GMT+0200 (Paris, Madrid (heure d’été)) PS"},{"index":{"_index":"phototheque","_type":"phototheque","_id":"_9834056"}},{"id":453,"indexCIJW":"PH0314001008","dossier":"0314","sousdossier":"001","document":"008","lien":"y","photographe":"Luc PRISSET","agence":"ATD Quart-Monde","droit_auteur":"PHOATD","droit_image":"TACITE","contenu":"Fond L.P. ANGERS 1987  N+C","date":"1987-02-28T23:00:00.000Z","lieu":"Angers (France)","description":"famille à identifier","local":"---","support":"ANB_","dateMaj":"2017-08-13T22:00:00.000Z","redacteur":"PS","content":" 453 PH0314001008 0314 001 008 y Luc PRISSET ATD Quart-Monde PHOATD TACITE Fond L.P. ANGERS 1987  N+C Sun Mar 01 1987 00:00:00 GMT+0100 (Paris, Madrid) Angers (France) famille à identifier --- ANB_ Mon Aug 14 2017 00:00:00 GMT+0200 (Paris, Madrid (heure d’été)) PS"},{"index":{"_index":"phototheque","_type":"phototheque","_id":"_9834057"}},{"id":454,"indexCIJW":"PH0314001009","dossier":"0314","sousdossier":"001","document":"009","lien":"y","photographe":"Luc PRISSET","agence":"ATD Quart-Monde","droit_auteur":"PHOATD","droit_image":"TACITE","contenu":"Fond L.P. ANGERS 1987  N+C","date":"1987-02-28T23:00:00.000Z","lieu":"Angers (France)","description":"famille à identifier","local":"---","support":"ANB_","dateMaj":"2017-08-13T22:00:00.000Z","redacteur":"PS","content":" 454 PH0314001009 0314 001 009 y Luc PRISSET ATD Quart-Monde PHOATD TACITE Fond L.P. ANGERS 1987  N+C Sun Mar 01 1987 00:00:00 GMT+0100 (Paris, Madrid) Angers (France) famille à identifier --- ANB_ Mon Aug 14 2017 00:00:00 GMT+0200 (Paris, Madrid (heure d’été)) PS"},{"index":{"_index":"phototheque","_type":"phototheque","_id":"_9834058"}},{"id":455,"indexCIJW":"PH0309001001","dossier":"0309","sousdossier":"001","document":"001","lien":"y","photographe":"L Prisset","agence":"ATD Quart-Monde","droit_auteur":"PHOATD","droit_image":"TACITE","contenu":"Fond L.P. REIMS 1983 N+C","temoin_ref":"Hannhart","date":"1983-10-31T23:00:00.000Z","lieu":"Reims (France)","description":"<p>\r\n\t REIMS (11/1983) reportage dans les familles et volontaires à la maison Quart Monde ==== Carl Egner + Fabienne Klein Lazare + P Davienne + Jean Toussaint</p>\r\n","local":"BSS","support":"ANB_","dateMaj":"2017-10-24T22:00:00.000Z","redacteur":"DB","content":" 455 PH0309001001 0309 001 001 y L Prisset ATD Quart-Monde PHOATD TACITE Fond L.P. REIMS 1983 N+C Hannhart Tue Nov 01 1983 00:00:00 GMT+0100 (Paris, Madrid) Reims (France) <p>\r\n\t REIMS (11/1983) reportage dans les familles et volontaires à la maison Quart Monde ==== Carl Egner + Fabienne Klein Lazare + P Davienne + Jean Toussaint</p>\r\n BSS ANB_ Wed Oct 25 2017 00:00:00 GMT+0200 (Paris, Madrid (heure d’été)) DB"},{"index":{"_index":"phototheque","_type":"phototheque","_id":"_9834059"}},{"id":456,"indexCIJW":"PH0352006001","dossier":"0352","sousdossier":"006","document":"001","lien":"n","photographe":"Benoît Reboul Salze","agence":"ATD Quart-Monde","droit_auteur":"PHOATD","droit_image":"TACITE","contenu":"A.I.F. congrès de New York (17/10/1994)","temoin_ref":"Reboul Salze","date":"1994-10-16T22:00:00.000Z","lieu":"New York  U.S.A.","description":"New York (17/10/1994)   A.I.F.  U.S.A.   -manque négatifs.===B.Cornuau+M.Vienot+F.DeMuylder+D.Guillet+S.Devins+A.Genin","local":"BSS","support":"ANB_","dateMaj":"2017-11-28T23:00:00.000Z","redacteur":"RF","content":" 456 PH0352006001 0352 006 001 n Benoît Reboul Salze ATD Quart-Monde PHOATD TACITE A.I.F. congrès de New York (17/10/1994) Reboul Salze Mon Oct 17 1994 00:00:00 GMT+0200 (Paris, Madrid (heure d’été)) New York  U.S.A. New York (17/10/1994)   A.I.F.  U.S.A.   -manque négatifs.===B.Cornuau+M.Vienot+F.DeMuylder+D.Guillet+S.Devins+A.Genin BSS ANB_ Wed Nov 29 2017 00:00:00 GMT+0100 (Paris, Madrid) RF"},{"index":{"_index":"phototheque","_type":"phototheque","_id":"_9834060"}},{"id":457,"indexCIJW":"PH0352002018","dossier":"0352","sousdossier":"002","document":"018","lien":"y","photographe":"Michel Buffard","agence":"ATD Quart-Monde","droit_auteur":"PHOATD","droit_image":"TACITE","contenu":"NEW YORK  U.S.A.   A.I.F (17/10/1994)  N+C","temoin_ref":"Buffard","date":"1994-10-16T22:00:00.000Z","lieu":"New York  U.S.A.","description":"<p>\r\n\tNew York U.S.A. A.I.F. ( 17/10/1994) ==== Diana Skelton Faujour +  Marie Fraznce Zimmer + Jeanine Bechet + Yolaine Couder + Graciane Beirriex + Hugette Redegeld + Gabrielle Erpicum + Charles Courtney + Stuart Williams + NiekTweehuysen + Chris Mohr + Benoit Fabiani + Martine Deseille Courvoisier + Benoit Reboul Salze + Françoise Vedrenne + Caroline Bloomfield</p>\r\n","local":"BSS","support":"ANB_","dateMaj":"2017-12-14T23:00:00.000Z","redacteur":"DB","content":" 457 PH0352002018 0352 002 018 y Michel Buffard ATD Quart-Monde PHOATD TACITE NEW YORK  U.S.A.   A.I.F (17/10/1994)  N+C Buffard Mon Oct 17 1994 00:00:00 GMT+0200 (Paris, Madrid (heure d’été)) New York  U.S.A. <p>\r\n\tNew York U.S.A. A.I.F. ( 17/10/1994) ==== Diana Skelton Faujour +  Marie Fraznce Zimmer + Jeanine Bechet + Yolaine Couder + Graciane Beirriex + Hugette Redegeld + Gabrielle Erpicum + Charles Courtney + Stuart Williams + NiekTweehuysen + Chris Mohr + Benoit Fabiani + Martine Deseille Courvoisier + Benoit Reboul Salze + Françoise Vedrenne + Caroline Bloomfield</p>\r\n BSS ANB_ Fri Dec 15 2017 00:00:00 GMT+0100 (Paris, Madrid) DB"},{"index":{"_index":"phototheque","_type":"phototheque","_id":"_9834061"}},{"id":458,"indexCIJW":"PH0352002019","dossier":"0352","sousdossier":"002","document":"019","lien":"y","photographe":"Michel Buffard","agence":"ATD Quart-Monde","droit_auteur":"PHOATD","droit_image":"TACITE","contenu":"NEW YORK  U.S.A.   A.I.F (17/10/1994)  N+C","temoin_ref":"Buffard","date":"1994-10-16T22:00:00.000Z","lieu":"New York  U.S.A.","description":"<p>\r\n\tNEW YORK U.S.A. A.I.F (17/10/1994) ==== Marie France Zimmer + Alwine deVos + Marco Ugarte + Chantal Laureau + Sarah Ortega + Gabrielle Erpicum + Ton Redegeld</p>\r\n","local":"BSS","support":"ANB_","dateMaj":"2017-12-14T23:00:00.000Z","redacteur":"DB","content":" 458 PH0352002019 0352 002 019 y Michel Buffard ATD Quart-Monde PHOATD TACITE NEW YORK  U.S.A.   A.I.F (17/10/1994)  N+C Buffard Mon Oct 17 1994 00:00:00 GMT+0200 (Paris, Madrid (heure d’été)) New York  U.S.A. <p>\r\n\tNEW YORK U.S.A. A.I.F (17/10/1994) ==== Marie France Zimmer + Alwine deVos + Marco Ugarte + Chantal Laureau + Sarah Ortega + Gabrielle Erpicum + Ton Redegeld</p>\r\n BSS ANB_ Fri Dec 15 2017 00:00:00 GMT+0100 (Paris, Madrid) DB"},{"index":{"_index":"phototheque","_type":"phototheque","_id":"_9834062"}},{"id":459,"indexCIJW":"PH0352002020","dossier":"0352","sousdossier":"002","document":"020","lien":"y","photographe":"Michel Buffard","agence":"ATD Quart-Monde","droit_auteur":"PHOATD","droit_image":"TACITE","contenu":"NEW YORK  U.S.A.   A.I.F (17/10/1994)  N+C","temoin_ref":"Buffard","date":"1994-10-16T22:00:00.000Z","lieu":"New York  U.S.A.","description":"<p>\r\n\tNEW YORK U.S.A. A.I.F (17/10/1994) ==== Stuart Williams + Huguette Redegeld +Susie Devins + Gabrielle Erpicum + Benoit Fabiani + Cathy Carenta Low + Niek Tweehuysen + Vincent Fanelli + Peggy Simmons + B.Couder + Marie Claude Buffard</p>\r\n","local":"BSS","support":"ANB_","dateMaj":"2017-12-14T23:00:00.000Z","redacteur":"DB","content":" 459 PH0352002020 0352 002 020 y Michel Buffard ATD Quart-Monde PHOATD TACITE NEW YORK  U.S.A.   A.I.F (17/10/1994)  N+C Buffard Mon Oct 17 1994 00:00:00 GMT+0200 (Paris, Madrid (heure d’été)) New York  U.S.A. <p>\r\n\tNEW YORK U.S.A. A.I.F (17/10/1994) ==== Stuart Williams + Huguette Redegeld +Susie Devins + Gabrielle Erpicum + Benoit Fabiani + Cathy Carenta Low + Niek Tweehuysen + Vincent Fanelli + Peggy Simmons + B.Couder + Marie Claude Buffard</p>\r\n BSS ANB_ Fri Dec 15 2017 00:00:00 GMT+0100 (Paris, Madrid) DB"},{"index":{"_index":"phototheque","_type":"phototheque","_id":"_9834063"}},{"id":460,"indexCIJW":"PH0352002021","dossier":"0352","sousdossier":"002","document":"021","lien":"y","photographe":"Michel Buffard","agence":"ATD Quart-Monde","droit_auteur":"PHOATD","droit_image":"TACITE","contenu":"NEW YORK  U.S.A.   A.I.J (17/10/1994)  N+C","temoin_ref":"Buffard","date":"1994-10-16T22:00:00.000Z","lieu":"New York  U.S.A.","description":"<p>\r\n\tNEW YORK U.S.A. A.I.F (17/10/1994) ==== Stuart Williams + Martine Deseille Courvoisier + Charles Courtney + Ingrid Hutter + Valerie  Brunner + Nelly Schenker + Charles Sleeth + Sylwester Dworaczek + Josephine Alumanah + Anasuya Murthy + Urs kehl</p>\r\n","local":"BSS","support":"ANB_","dateMaj":"2017-12-14T23:00:00.000Z","redacteur":"DB","content":" 460 PH0352002021 0352 002 021 y Michel Buffard ATD Quart-Monde PHOATD TACITE NEW YORK  U.S.A.   A.I.J (17/10/1994)  N+C Buffard Mon Oct 17 1994 00:00:00 GMT+0200 (Paris, Madrid (heure d’été)) New York  U.S.A. <p>\r\n\tNEW YORK U.S.A. A.I.F (17/10/1994) ==== Stuart Williams + Martine Deseille Courvoisier + Charles Courtney + Ingrid Hutter + Valerie  Brunner + Nelly Schenker + Charles Sleeth + Sylwester Dworaczek + Josephine Alumanah + Anasuya Murthy + Urs kehl</p>\r\n BSS ANB_ Fri Dec 15 2017 00:00:00 GMT+0100 (Paris, Madrid) DB"},{"index":{"_index":"phototheque","_type":"phototheque","_id":"_9834064"}},{"id":461,"indexCIJW":"PH0292001044","dossier":"0292","sousdossier":"001","document":"044","lien":"y","photographe":"Luc PRISSET","agence":"ATD Quart-Monde","droit_auteur":"PHOATD","droit_image":"TACITE","contenu":"Fond L.P. SUISSE 1983   N+C","temoin_ref":"Erika Forney","date":"1983-06-30T22:00:00.000Z","lieu":"Suisse","description":"Bâle? Fribourg?  Treyvaux? Genève ?   à identifier  Travaux des champs + stage en montagne neige... travaux construction+ travaux de ferme ++++1983 juillet: 13 : Monsieur Georges Progin, Elisabeth et Catherine Progin  1983 juillet: 14 - 18 : Madame Jeannette Progin, Catherine Progin, Monsieur Georges Progin, Elisabeth Progin  1983 juillet: 19 : Catherine Progin, Monsieur Progin, Elisabeth Progin  1983 juillet: 20 :Madame Jeannette Progin, Catherine, Monsieur Progin  1893 juillet : 22 – 37 : Madame Jeannette Progin  ","local":"---","support":"ANB_","dateMaj":"2011-05-24T22:00:00.000Z","redacteur":"PS","content":" 461 PH0292001044 0292 001 044 y Luc PRISSET ATD Quart-Monde PHOATD TACITE Fond L.P. SUISSE 1983   N+C Erika Forney Fri Jul 01 1983 00:00:00 GMT+0200 (Paris, Madrid (heure d’été)) Suisse Bâle? Fribourg?  Treyvaux? Genève ?   à identifier  Travaux des champs + stage en montagne neige... travaux construction+ travaux de ferme ++++1983 juillet: 13 : Monsieur Georges Progin, Elisabeth et Catherine Progin  1983 juillet: 14 - 18 : Madame Jeannette Progin, Catherine Progin, Monsieur Georges Progin, Elisabeth Progin  1983 juillet: 19 : Catherine Progin, Monsieur Progin, Elisabeth Progin  1983 juillet: 20 :Madame Jeannette Progin, Catherine, Monsieur Progin  1893 juillet : 22 – 37 : Madame Jeannette Progin   --- ANB_ Wed May 25 2011 00:00:00 GMT+0200 (Paris, Madrid (heure d’été)) PS"},{"index":{"_index":"phototheque","_type":"phototheque","_id":"_9834065"}},{"id":462,"indexCIJW":"PH0292001045","dossier":"0292","sousdossier":"001","document":"045","lien":"y","photographe":"Luc PRISSET","agence":"ATD Quart-Monde","droit_auteur":"PHOATD","droit_image":"TACITE","contenu":"Fond L.P. SUISSE 1983   N+C","temoin_ref":"Erika Forney","date":"1983-06-30T22:00:00.000Z","lieu":"Suisse","description":"Bâle? Fribourg?  Treyvaux? Genève ?   à identifier  Travaux des champs + stage en montagne neige... travaux construction+ travaux de ferme ++++1983 juillet : 15A, 16A : Monsieur Georges Progin  1983 juillet : 17A – 21A : Elisabeth Progin  1983 juillet : 22A – 31A : Madame Jeannette Progin  1983 juillet : 32A – 35A : Madame Progin et sa fille Elisabeth  1983 juillet : 36A : Madame Progin, Elisabeth et Catherine  1983 juillet : 37A : Elisabeth, Madame Progin, Catherine Progin  ","local":"---","support":"ANB_","dateMaj":"2011-05-24T22:00:00.000Z","redacteur":"PS","content":" 462 PH0292001045 0292 001 045 y Luc PRISSET ATD Quart-Monde PHOATD TACITE Fond L.P. SUISSE 1983   N+C Erika Forney Fri Jul 01 1983 00:00:00 GMT+0200 (Paris, Madrid (heure d’été)) Suisse Bâle? Fribourg?  Treyvaux? Genève ?   à identifier  Travaux des champs + stage en montagne neige... travaux construction+ travaux de ferme ++++1983 juillet : 15A, 16A : Monsieur Georges Progin  1983 juillet : 17A – 21A : Elisabeth Progin  1983 juillet : 22A – 31A : Madame Jeannette Progin  1983 juillet : 32A – 35A : Madame Progin et sa fille Elisabeth  1983 juillet : 36A : Madame Progin, Elisabeth et Catherine  1983 juillet : 37A : Elisabeth, Madame Progin, Catherine Progin   --- ANB_ Wed May 25 2011 00:00:00 GMT+0200 (Paris, Madrid (heure d’été)) PS"},{"index":{"_index":"phototheque","_type":"phototheque","_id":"_9834066"}},{"id":463,"indexCIJW":"PH0292001046","dossier":"0292","sousdossier":"001","document":"046","lien":"y","photographe":"Luc PRISSET","agence":"ATD Quart-Monde","droit_auteur":"PHOATD","droit_image":"TACITE","contenu":"Fond L.P. SUISSE 1983   N+C","temoin_ref":"Erika Forney","date":"1983-06-30T22:00:00.000Z","lieu":"Suisse","description":"Bâle? Fribourg?  Treyvaux? Genève ?   à identifier  Travaux des champs + stage en montagne neige... travaux construction+ travaux de ferme +++ 1983 juillet : 42A : Catherine Progin  1983 juillet : 1 : Madame Jeannette Progin  1983 juillet : 2 – 15 : Catherine Progin  1983 juillet : 16 – 38 : vacances familiales  ","local":"---","support":"ANB_","dateMaj":"2011-05-24T22:00:00.000Z","redacteur":"PS","content":" 463 PH0292001046 0292 001 046 y Luc PRISSET ATD Quart-Monde PHOATD TACITE Fond L.P. SUISSE 1983   N+C Erika Forney Fri Jul 01 1983 00:00:00 GMT+0200 (Paris, Madrid (heure d’été)) Suisse Bâle? Fribourg?  Treyvaux? Genève ?   à identifier  Travaux des champs + stage en montagne neige... travaux construction+ travaux de ferme +++ 1983 juillet : 42A : Catherine Progin  1983 juillet : 1 : Madame Jeannette Progin  1983 juillet : 2 – 15 : Catherine Progin  1983 juillet : 16 – 38 : vacances familiales   --- ANB_ Wed May 25 2011 00:00:00 GMT+0200 (Paris, Madrid (heure d’été)) PS"},{"index":{"_index":"phototheque","_type":"phototheque","_id":"_9834067"}},{"id":464,"indexCIJW":"PH0292001047","dossier":"0292","sousdossier":"001","document":"047","lien":"y","photographe":"Luc PRISSET","agence":"ATD Quart-Monde","droit_auteur":"PHOATD","droit_image":"TACITE","contenu":"Fond L.P. SUISSE 1983   N+C","temoin_ref":"Erika Forney","date":"1983-06-30T22:00:00.000Z","lieu":"Suisse","description":"Bâle? Fribourg?  Treyvaux? Genève ?   à identifier  Travaux des champs + stage en montagne neige... travaux construction+ travaux de ferme +++ 1983 juillet : 42A : Mme Progin, Elisabeth et Catherine  1983 juillet : 1, 1A: Catherine et Elisabeth Progin  1983 juillet : 2A : Catherine, Elisabeth Progin  1983 juillet : 3A – 7A : Elisabeth Progin  1983 juillet : 8A – 13A : Mme Jeannette Progin  1983 juillet : 14A : Elisabeth et Catherine Progin  1983 juillet : 15A – 17 A : vacances familiales  1983 juillet : 18A : Anne-Claire Brand, Mme ??, Eugen Brand, Olivier Wuillemin  1983 juillet : 19A : Annelies Wuillemin, Mme ??  1983 juillet : 20A – 26A : familles en vacances  1983 juillet : 27A – 29A : Eugen Brand, Heinz Ritter  1983 juillet: 30A, 31A: Mme ??, Annelies Wuillemin, enfant ??, Peter Schäppi  1983 juillet : 32A : Mme ??, Annelies Wuillemin, enfant ??  1983 juillet : 33A, 34A : Olivier Wuillemin et son fils Timothée  1983 juillet : 35A : Annelies Wuillemin, enfant ??, Peter Schäppi  1983 juillet : 36A : Zacharie Wuillemin, Anne-Claire Brand, Mme ??  1983 juillet : 37A : Mme ??, joueuse de flute, Zacharie Wuillemin  ","local":"---","support":"ANB_","dateMaj":"2011-05-24T22:00:00.000Z","redacteur":"PS","content":" 464 PH0292001047 0292 001 047 y Luc PRISSET ATD Quart-Monde PHOATD TACITE Fond L.P. SUISSE 1983   N+C Erika Forney Fri Jul 01 1983 00:00:00 GMT+0200 (Paris, Madrid (heure d’été)) Suisse Bâle? Fribourg?  Treyvaux? Genève ?   à identifier  Travaux des champs + stage en montagne neige... travaux construction+ travaux de ferme +++ 1983 juillet : 42A : Mme Progin, Elisabeth et Catherine  1983 juillet : 1, 1A: Catherine et Elisabeth Progin  1983 juillet : 2A : Catherine, Elisabeth Progin  1983 juillet : 3A – 7A : Elisabeth Progin  1983 juillet : 8A – 13A : Mme Jeannette Progin  1983 juillet : 14A : Elisabeth et Catherine Progin  1983 juillet : 15A – 17 A : vacances familiales  1983 juillet : 18A : Anne-Claire Brand, Mme ??, Eugen Brand, Olivier Wuillemin  1983 juillet : 19A : Annelies Wuillemin, Mme ??  1983 juillet : 20A – 26A : familles en vacances  1983 juillet : 27A – 29A : Eugen Brand, Heinz Ritter  1983 juillet: 30A, 31A: Mme ??, Annelies Wuillemin, enfant ??, Peter Schäppi  1983 juillet : 32A : Mme ??, Annelies Wuillemin, enfant ??  1983 juillet : 33A, 34A : Olivier Wuillemin et son fils Timothée  1983 juillet : 35A : Annelies Wuillemin, enfant ??, Peter Schäppi  1983 juillet : 36A : Zacharie Wuillemin, Anne-Claire Brand, Mme ??  1983 juillet : 37A : Mme ??, joueuse de flute, Zacharie Wuillemin   --- ANB_ Wed May 25 2011 00:00:00 GMT+0200 (Paris, Madrid (heure d’été)) PS"},{"index":{"_index":"phototheque","_type":"phototheque","_id":"_9834068"}},{"id":465,"indexCIJW":"PH0292001048","dossier":"0292","sousdossier":"001","document":"048","lien":"y","photographe":"Luc PRISSET","agence":"ATD Quart-Monde","droit_auteur":"PHOATD","droit_image":"TACITE","contenu":"Fond L.P. SUISSE 1983   N+C","temoin_ref":"Erika Forney","date":"1983-06-30T22:00:00.000Z","lieu":"Suisse","description":"Bâle? Fribourg?  Treyvaux? Genève ?   à identifier  Travaux des champs + stage en montagne neige... travaux construction+ travaux de ferme +++ 1983 juillet : 41A, 1 – 10 : mère et enfant en accueil vacances  1983 juillet : 11 – 19 : X et Heinz Ritter  1983 juillet : 20 : Heinz Ritter  1983 juillet : 21 : ??  1983 juillet : 22 – 24 : Zacharie Wuillemin et X  1983 juillet : 28 – 33 :Otto Raetzo, Marianne Schmutz (en avant plan)  1983 juillet : 36, 37 : Annelies Wuillemin  ","local":"---","support":"ANB_","dateMaj":"2011-05-24T22:00:00.000Z","redacteur":"PS","content":" 465 PH0292001048 0292 001 048 y Luc PRISSET ATD Quart-Monde PHOATD TACITE Fond L.P. SUISSE 1983   N+C Erika Forney Fri Jul 01 1983 00:00:00 GMT+0200 (Paris, Madrid (heure d’été)) Suisse Bâle? Fribourg?  Treyvaux? Genève ?   à identifier  Travaux des champs + stage en montagne neige... travaux construction+ travaux de ferme +++ 1983 juillet : 41A, 1 – 10 : mère et enfant en accueil vacances  1983 juillet : 11 – 19 : X et Heinz Ritter  1983 juillet : 20 : Heinz Ritter  1983 juillet : 21 : ??  1983 juillet : 22 – 24 : Zacharie Wuillemin et X  1983 juillet : 28 – 33 :Otto Raetzo, Marianne Schmutz (en avant plan)  1983 juillet : 36, 37 : Annelies Wuillemin   --- ANB_ Wed May 25 2011 00:00:00 GMT+0200 (Paris, Madrid (heure d’été)) PS"},{"index":{"_index":"phototheque","_type":"phototheque","_id":"_9834069"}},{"id":466,"indexCIJW":"PH0292001049","dossier":"0292","sousdossier":"001","document":"049","lien":"y","photographe":"Luc PRISSET","agence":"ATD Quart-Monde","droit_auteur":"PHOATD","droit_image":"TACITE","contenu":"Fond L.P. SUISSE 1983   N+C","temoin_ref":"Erika Forney","date":"1983-06-30T22:00:00.000Z","lieu":"Suisse","description":"Bâle? Fribourg?  Treyvaux? Genève ?   à identifier  Travaux des champs + stage en montagne neige... travaux construction+ travaux de ferme ++++ 1983 juillet :42A, 1 – 13 : activités  1983 juillet : 14 – 17 : Eugen Brand  1983 juillet : 18 – 20 : Annelies Wuillemin  1983 juillet : 21, 22 : ??  1983 juillet : 23, 24 : Rosanna Guscetti-Christen  1983 juillet : 26 -29 : Kathrin … et ???  1983 juillet : 31, 32 : Colette Sierro  ","local":"---","support":"ANB_","dateMaj":"2011-05-24T22:00:00.000Z","redacteur":"PS","content":" 466 PH0292001049 0292 001 049 y Luc PRISSET ATD Quart-Monde PHOATD TACITE Fond L.P. SUISSE 1983   N+C Erika Forney Fri Jul 01 1983 00:00:00 GMT+0200 (Paris, Madrid (heure d’été)) Suisse Bâle? Fribourg?  Treyvaux? Genève ?   à identifier  Travaux des champs + stage en montagne neige... travaux construction+ travaux de ferme ++++ 1983 juillet :42A, 1 – 13 : activités  1983 juillet : 14 – 17 : Eugen Brand  1983 juillet : 18 – 20 : Annelies Wuillemin  1983 juillet : 21, 22 : ??  1983 juillet : 23, 24 : Rosanna Guscetti-Christen  1983 juillet : 26 -29 : Kathrin … et ???  1983 juillet : 31, 32 : Colette Sierro   --- ANB_ Wed May 25 2011 00:00:00 GMT+0200 (Paris, Madrid (heure d’été)) PS"},{"index":{"_index":"phototheque","_type":"phototheque","_id":"_9834070"}},{"id":467,"indexCIJW":"PH0292001050","dossier":"0292","sousdossier":"001","document":"050","lien":"y","photographe":"Luc PRISSET","agence":"ATD Quart-Monde","droit_auteur":"PHOATD","droit_image":"TACITE","contenu":"Fond L.P. SUISSE 1983   N+C","temoin_ref":"Erika Forney","date":"1983-06-30T22:00:00.000Z","lieu":"Suisse","description":"Bâle? Fribourg?  Treyvaux? Genève ?   à identifier  Travaux des champs + stage en montagne neige... travaux construction+ travaux de ferme ++++ 1983 juillet : 23 : Marianne Schmutz, Annelies Wuillemin, Eugen Brand  1983 juillet : 24 : Marianne Schmutz, Otto Raetzo, Eugen Brand, Annelies Wuillemin  1983 juillet : 26 : Otto Raetzo, Marianne Schmutz, Eugen Brand  1983 juillet : 27 : Rosanna Guscetti-Christen  1983 juillet : 32 : Colette Sierro  1983 juillet : 35, 36 : Heinz Ritter et enfant  1983 juillet : 37, 38 : Annelies Wuillemin, Kathrin …, Otto Raetzo, Marianne Schmutz  ","local":"---","support":"ANB_","dateMaj":"2011-05-24T22:00:00.000Z","redacteur":"PS","content":" 467 PH0292001050 0292 001 050 y Luc PRISSET ATD Quart-Monde PHOATD TACITE Fond L.P. SUISSE 1983   N+C Erika Forney Fri Jul 01 1983 00:00:00 GMT+0200 (Paris, Madrid (heure d’été)) Suisse Bâle? Fribourg?  Treyvaux? Genève ?   à identifier  Travaux des champs + stage en montagne neige... travaux construction+ travaux de ferme ++++ 1983 juillet : 23 : Marianne Schmutz, Annelies Wuillemin, Eugen Brand  1983 juillet : 24 : Marianne Schmutz, Otto Raetzo, Eugen Brand, Annelies Wuillemin  1983 juillet : 26 : Otto Raetzo, Marianne Schmutz, Eugen Brand  1983 juillet : 27 : Rosanna Guscetti-Christen  1983 juillet : 32 : Colette Sierro  1983 juillet : 35, 36 : Heinz Ritter et enfant  1983 juillet : 37, 38 : Annelies Wuillemin, Kathrin …, Otto Raetzo, Marianne Schmutz   --- ANB_ Wed May 25 2011 00:00:00 GMT+0200 (Paris, Madrid (heure d’été)) PS"},{"index":{"_index":"phototheque","_type":"phototheque","_id":"_9834071"}},{"id":468,"indexCIJW":"PH0292001051","dossier":"0292","sousdossier":"001","document":"051","lien":"y","photographe":"Luc PRISSET","agence":"ATD Quart-Monde","droit_auteur":"PHOATD","droit_image":"TACITE","contenu":"Fond L.P. SUISSE 1983   N+C","temoin_ref":"Erika Forney","date":"1983-06-30T22:00:00.000Z","lieu":"Suisse","description":"Bâle? Fribourg?  Treyvaux? Genève ?   à identifier  Travaux des champs + stage en montagne neige... travaux construction+ travaux de ferme ++++ 1983 juillet : 42A, 1 : Mme ??, enfant, Annelies Wuillemin  1983 juillet : 2 : Eugen Brand, Marianne Schmutz  1983 juillet : 3, 4 : Annelies Wuillemin, Anne-Claire Brand, Otto Raetzo, Marianne Schmutz, Eugen Brand  1983 juillet : 7, 8 : Timothée Wuillemin  1983 juillet : 9 – 11 : Zacharie et Timothée Wuillemin  1983 juillet : 12 – 16 : Timothée Wuillemin  1983 juillet : 17 – 19 : Heinz Ritter  1983 juillet : 20 : Otto Raetzo  1983 juillet : 25 : Anne-Claire Brand, Liliane Piller  1983 juillet : 31 – 34 : Anne-Claire Brand, Liliane Piller  1983 juillet : 35 – 38 : Madame Liliane Piller     ","local":"---","support":"ANB_","dateMaj":"2011-05-24T22:00:00.000Z","redacteur":"PS","content":" 468 PH0292001051 0292 001 051 y Luc PRISSET ATD Quart-Monde PHOATD TACITE Fond L.P. SUISSE 1983   N+C Erika Forney Fri Jul 01 1983 00:00:00 GMT+0200 (Paris, Madrid (heure d’été)) Suisse Bâle? Fribourg?  Treyvaux? Genève ?   à identifier  Travaux des champs + stage en montagne neige... travaux construction+ travaux de ferme ++++ 1983 juillet : 42A, 1 : Mme ??, enfant, Annelies Wuillemin  1983 juillet : 2 : Eugen Brand, Marianne Schmutz  1983 juillet : 3, 4 : Annelies Wuillemin, Anne-Claire Brand, Otto Raetzo, Marianne Schmutz, Eugen Brand  1983 juillet : 7, 8 : Timothée Wuillemin  1983 juillet : 9 – 11 : Zacharie et Timothée Wuillemin  1983 juillet : 12 – 16 : Timothée Wuillemin  1983 juillet : 17 – 19 : Heinz Ritter  1983 juillet : 20 : Otto Raetzo  1983 juillet : 25 : Anne-Claire Brand, Liliane Piller  1983 juillet : 31 – 34 : Anne-Claire Brand, Liliane Piller  1983 juillet : 35 – 38 : Madame Liliane Piller      --- ANB_ Wed May 25 2011 00:00:00 GMT+0200 (Paris, Madrid (heure d’été)) PS"},{"index":{"_index":"phototheque","_type":"phototheque","_id":"_9834072"}},{"id":469,"indexCIJW":"PH0292001052","dossier":"0292","sousdossier":"001","document":"052","lien":"y","photographe":"Luc PRISSET","agence":"ATD Quart-Monde","droit_auteur":"PHOATD","droit_image":"TACITE","contenu":"Fond L.P. SUISSE 1983   N+C","temoin_ref":"Erika Forney","date":"1983-06-30T22:00:00.000Z","lieu":"Suisse","description":"Bâle? Fribourg?  Treyvaux? Genève ?   à identifier  Travaux des champs + stage en montagne neige... travaux construction+ travaux de ferme +++ 1983 juillet : 42A – 4A : Madame Liliane Piller  1983 juillet : 5A : Liliane Piller, Anne-Claire Brand  1983 juillet : 6A – 22A : Madame Liliane Piller  1983 juillet : 23A – 26A : Madame Liliane Piller, Anne-Claire Brand  1983 juillet : 27A – 32A : Court Chemin, Fribourg  1983 juillet : 32A – 37A : Madame Liliane Piller  ","local":"---","support":"ANB_","dateMaj":"2011-05-24T22:00:00.000Z","redacteur":"PS","content":" 469 PH0292001052 0292 001 052 y Luc PRISSET ATD Quart-Monde PHOATD TACITE Fond L.P. SUISSE 1983   N+C Erika Forney Fri Jul 01 1983 00:00:00 GMT+0200 (Paris, Madrid (heure d’été)) Suisse Bâle? Fribourg?  Treyvaux? Genève ?   à identifier  Travaux des champs + stage en montagne neige... travaux construction+ travaux de ferme +++ 1983 juillet : 42A – 4A : Madame Liliane Piller  1983 juillet : 5A : Liliane Piller, Anne-Claire Brand  1983 juillet : 6A – 22A : Madame Liliane Piller  1983 juillet : 23A – 26A : Madame Liliane Piller, Anne-Claire Brand  1983 juillet : 27A – 32A : Court Chemin, Fribourg  1983 juillet : 32A – 37A : Madame Liliane Piller   --- ANB_ Wed May 25 2011 00:00:00 GMT+0200 (Paris, Madrid (heure d’été)) PS"},{"index":{"_index":"phototheque","_type":"phototheque","_id":"_9834073"}},{"id":470,"indexCIJW":"PH0292001053","dossier":"0292","sousdossier":"001","document":"053","lien":"y","photographe":"Luc PRISSET","agence":"ATD Quart-Monde","droit_auteur":"PHOATD","droit_image":"TACITE","contenu":"Fond L.P. SUISSE 1983   N+C","temoin_ref":"Erika Forney","date":"1983-06-30T22:00:00.000Z","lieu":"Suisse","description":"Bâle? Fribourg?  Treyvaux? Genève ?   à identifier  Travaux des champs + stage en montagne neige... travaux construction+ travaux de ferme ++++ 1983 juillet : 42A : famille Piller  1983 juillet : 1A – 37A : famille Piller  ","local":"---","support":"ANB_","dateMaj":"2011-05-24T22:00:00.000Z","redacteur":"PS","content":" 470 PH0292001053 0292 001 053 y Luc PRISSET ATD Quart-Monde PHOATD TACITE Fond L.P. SUISSE 1983   N+C Erika Forney Fri Jul 01 1983 00:00:00 GMT+0200 (Paris, Madrid (heure d’été)) Suisse Bâle? Fribourg?  Treyvaux? Genève ?   à identifier  Travaux des champs + stage en montagne neige... travaux construction+ travaux de ferme ++++ 1983 juillet : 42A : famille Piller  1983 juillet : 1A – 37A : famille Piller   --- ANB_ Wed May 25 2011 00:00:00 GMT+0200 (Paris, Madrid (heure d’été)) PS"},{"index":{"_index":"phototheque","_type":"phototheque","_id":"_9834074"}},{"id":471,"indexCIJW":"PH0292001054","dossier":"0292","sousdossier":"001","document":"054","lien":"y","photographe":"Luc PRISSET","agence":"ATD Quart-Monde","droit_auteur":"PHOATD","droit_image":"TACITE","contenu":"Fond L.P. SUISSE 1983   N+C","temoin_ref":"Erika Forney","date":"1983-06-30T22:00:00.000Z","lieu":"Suisse","description":"Bâle? Fribourg?  Treyvaux? Genève ?   à identifier  Travaux des champs + stage en montagne neige... travaux construction+ travaux de ferme ++++ 1983 juillet : 42A : Liliane Piller  1983 juillet : 1 – 15 : Liliane Piller  1983 juillet : 16, 17 :rénovation habitat famille Piller  1983 juillet : 19 – 33 : Heinz Wuillemin sur l’alpage  1983 juillet : 34 : Olivier Wuillemin  1983 juillet : 35 : Heinz Wuillemin  1983 juillet : 36, 37 : Zacharie et Timothée Wuillemin  1983 juillet : 38 : Heinz Wuillemin, Olivier Wuillemin  ","local":"---","support":"ANB_","dateMaj":"2011-05-24T22:00:00.000Z","redacteur":"PS","content":" 471 PH0292001054 0292 001 054 y Luc PRISSET ATD Quart-Monde PHOATD TACITE Fond L.P. SUISSE 1983   N+C Erika Forney Fri Jul 01 1983 00:00:00 GMT+0200 (Paris, Madrid (heure d’été)) Suisse Bâle? Fribourg?  Treyvaux? Genève ?   à identifier  Travaux des champs + stage en montagne neige... travaux construction+ travaux de ferme ++++ 1983 juillet : 42A : Liliane Piller  1983 juillet : 1 – 15 : Liliane Piller  1983 juillet : 16, 17 :rénovation habitat famille Piller  1983 juillet : 19 – 33 : Heinz Wuillemin sur l’alpage  1983 juillet : 34 : Olivier Wuillemin  1983 juillet : 35 : Heinz Wuillemin  1983 juillet : 36, 37 : Zacharie et Timothée Wuillemin  1983 juillet : 38 : Heinz Wuillemin, Olivier Wuillemin   --- ANB_ Wed May 25 2011 00:00:00 GMT+0200 (Paris, Madrid (heure d’été)) PS"},{"index":{"_index":"phototheque","_type":"phototheque","_id":"_9834075"}},{"id":472,"indexCIJW":"PH0292001055","dossier":"0292","sousdossier":"001","document":"055","lien":"y","photographe":"Luc PRISSET","agence":"ATD Quart-Monde","droit_auteur":"PHOATD","droit_image":"TACITE","contenu":"Fond L.P. SUISSE 1983   N+C","temoin_ref":"Erika Forney","date":"1983-06-30T22:00:00.000Z","lieu":"Suisse","description":"Bâle? Fribourg?  Treyvaux? Genève ?   à identifier  Travaux des champs + stage en montagne neige... travaux construction+ travaux de ferme ++++1983 juillet : 42A, 1 – 5 : Heinz Ritter et famille 1983 juillet : 6 – 14 : Liliane Piller  1983 juillet : 15 – 19 : Anne-Claire Brand, Liliane Piller  1983 juillet : 20 – 36 : Liliane Piller et famille  1983 juillet : 37, 38 : Heinz Wuillemin  ","local":"---","support":"ANB_","dateMaj":"2011-05-24T22:00:00.000Z","redacteur":"PS","content":" 472 PH0292001055 0292 001 055 y Luc PRISSET ATD Quart-Monde PHOATD TACITE Fond L.P. SUISSE 1983   N+C Erika Forney Fri Jul 01 1983 00:00:00 GMT+0200 (Paris, Madrid (heure d’été)) Suisse Bâle? Fribourg?  Treyvaux? Genève ?   à identifier  Travaux des champs + stage en montagne neige... travaux construction+ travaux de ferme ++++1983 juillet : 42A, 1 – 5 : Heinz Ritter et famille 1983 juillet : 6 – 14 : Liliane Piller  1983 juillet : 15 – 19 : Anne-Claire Brand, Liliane Piller  1983 juillet : 20 – 36 : Liliane Piller et famille  1983 juillet : 37, 38 : Heinz Wuillemin   --- ANB_ Wed May 25 2011 00:00:00 GMT+0200 (Paris, Madrid (heure d’été)) PS"},{"index":{"_index":"phototheque","_type":"phototheque","_id":"_9834076"}},{"id":473,"indexCIJW":"PH0292001056","dossier":"0292","sousdossier":"001","document":"056","lien":"y","photographe":"Luc PRISSET","agence":"ATD Quart-Monde","droit_auteur":"PHOATD","droit_image":"TACITE","contenu":"Fond L.P. SUISSE 1983   N+C","temoin_ref":"Erika Forney","date":"1983-06-30T22:00:00.000Z","lieu":"Suisse","description":"Bâle? Fribourg?  Treyvaux? Genève ?   à identifier  Travaux des champs + stage en montagne neige... travaux construction+ travaux de ferme +++ 1983 juillet : 42A, 1 – 9A : Heinz Wuillemin  1983 juillet : 10A, 11A : Zacharie, Timothée Wuillemin, Olivier Wuillemin, Heinz Wuillemin  1983 juillet : 12A : Timothée et Olivier Wuillemin, Heinz Wuillemin  1983 juillet : 13A – 15A : Zacharie, Heinz Wuillemin, Timothée et Olivier Wuillemin  1983 juillet :16A : Heinz Wuilemin, Zacharie, Timothée et Olivier Wuillemin  1983 juillet : 17A : Heinz Wuillemin  1983 juillet : 18A : Heinz Wuillemin, Olivier Wuillemin  1983 juillet : 19A – 25A : Heinz Wuillemin  1983 juillet : 26A : Heinz Wuillemin, Olivier et Zacharie Wuillemin  1983 juillet : Timothée et Zacharie Wuillemin  1983 juillet : 28A – 31A : Heinz Wuillemin  1983 juillet : 32A, 33A : Heinz Wuillemin, Olivier Wuillemin  1983 juillet : 34A : Heinz Wuillemin  1983 juillet : 35A – 37A : Zacharie Wuillemin  ","local":"---","support":"ANB_","dateMaj":"2011-05-24T22:00:00.000Z","redacteur":"PS","content":" 473 PH0292001056 0292 001 056 y Luc PRISSET ATD Quart-Monde PHOATD TACITE Fond L.P. SUISSE 1983   N+C Erika Forney Fri Jul 01 1983 00:00:00 GMT+0200 (Paris, Madrid (heure d’été)) Suisse Bâle? Fribourg?  Treyvaux? Genève ?   à identifier  Travaux des champs + stage en montagne neige... travaux construction+ travaux de ferme +++ 1983 juillet : 42A, 1 – 9A : Heinz Wuillemin  1983 juillet : 10A, 11A : Zacharie, Timothée Wuillemin, Olivier Wuillemin, Heinz Wuillemin  1983 juillet : 12A : Timothée et Olivier Wuillemin, Heinz Wuillemin  1983 juillet : 13A – 15A : Zacharie, Heinz Wuillemin, Timothée et Olivier Wuillemin  1983 juillet :16A : Heinz Wuilemin, Zacharie, Timothée et Olivier Wuillemin  1983 juillet : 17A : Heinz Wuillemin  1983 juillet : 18A : Heinz Wuillemin, Olivier Wuillemin  1983 juillet : 19A – 25A : Heinz Wuillemin  1983 juillet : 26A : Heinz Wuillemin, Olivier et Zacharie Wuillemin  1983 juillet : Timothée et Zacharie Wuillemin  1983 juillet : 28A – 31A : Heinz Wuillemin  1983 juillet : 32A, 33A : Heinz Wuillemin, Olivier Wuillemin  1983 juillet : 34A : Heinz Wuillemin  1983 juillet : 35A – 37A : Zacharie Wuillemin   --- ANB_ Wed May 25 2011 00:00:00 GMT+0200 (Paris, Madrid (heure d’été)) PS"},{"index":{"_index":"phototheque","_type":"phototheque","_id":"_9834077"}},{"id":474,"indexCIJW":"PH0292001057","dossier":"0292","sousdossier":"001","document":"057","lien":"y","photographe":"Luc PRISSET","agence":"ATD Quart-Monde","droit_auteur":"PHOATD","droit_image":"TACITE","contenu":"Fond L.P. SUISSE 1983   N+C","temoin_ref":"Erika Forney","date":"1983-06-30T22:00:00.000Z","lieu":"Suisse","description":"Bâle? Fribourg?  Treyvaux? Genève ?   à identifier  Travaux des champs + stage en montagne neige... travaux construction+ travaux de ferme +++ 1983 juillet : 42A, 1, 2 : Olivier Wuillemin, Heinz Wuillemin  1983 juillet : 2A – 13A : Heinz Wuillemin  1983 juillet : 14A : Zacharie Wuillemin  1983 juillet : 15A – 17A : Heinz Wuillemin  1983 juillet : 18A : Heinz Wuillemin, Olivier Wuillemin  1983 juillet : 19A – 24A : Heinz Wuillemin  1983 juillet : 25A, 26A : Zacharie et Timothée Wuillemin  1983 juillet : 27A – 37A : Heinz Wuillemin  ","local":"---","support":"ANB_","dateMaj":"2011-05-24T22:00:00.000Z","redacteur":"PS","content":" 474 PH0292001057 0292 001 057 y Luc PRISSET ATD Quart-Monde PHOATD TACITE Fond L.P. SUISSE 1983   N+C Erika Forney Fri Jul 01 1983 00:00:00 GMT+0200 (Paris, Madrid (heure d’été)) Suisse Bâle? Fribourg?  Treyvaux? Genève ?   à identifier  Travaux des champs + stage en montagne neige... travaux construction+ travaux de ferme +++ 1983 juillet : 42A, 1, 2 : Olivier Wuillemin, Heinz Wuillemin  1983 juillet : 2A – 13A : Heinz Wuillemin  1983 juillet : 14A : Zacharie Wuillemin  1983 juillet : 15A – 17A : Heinz Wuillemin  1983 juillet : 18A : Heinz Wuillemin, Olivier Wuillemin  1983 juillet : 19A – 24A : Heinz Wuillemin  1983 juillet : 25A, 26A : Zacharie et Timothée Wuillemin  1983 juillet : 27A – 37A : Heinz Wuillemin   --- ANB_ Wed May 25 2011 00:00:00 GMT+0200 (Paris, Madrid (heure d’été)) PS"},{"index":{"_index":"phototheque","_type":"phototheque","_id":"_9834078"}},{"id":475,"indexCIJW":"PH0292001058","dossier":"0292","sousdossier":"001","document":"058","lien":"y","photographe":"Luc PRISSET","agence":"ATD Quart-Monde","droit_auteur":"PHOATD","droit_image":"TACITE","contenu":"Fond L.P. SUISSE 1983   N+C","temoin_ref":"Erika Forney","date":"1983-06-30T22:00:00.000Z","lieu":"Suisse","description":"Bâle? Fribourg?  Treyvaux? Genève ?   à identifier  Travaux des champs + stage en montagne neige... travaux construction+ travaux de ferme +++ 1983 juillet : 1, 1A : Timothée Wuillemin  1983 juillet : 2A – 4A : Heinz Wuillemin  1983 juillet : 5A : Olivier Wuillemin, Heinz Wuillemin  1983 juillet : 6A – 14A : Heinz Wuillemin  1983 juillet : 15A : Heinz Wuillemin, Zacharie Wuillemin  1983 juillet : 16A – 27A : Heinz Wuillemin  ","local":"---","support":"ANB_","dateMaj":"2011-05-24T22:00:00.000Z","redacteur":"PS","content":" 475 PH0292001058 0292 001 058 y Luc PRISSET ATD Quart-Monde PHOATD TACITE Fond L.P. SUISSE 1983   N+C Erika Forney Fri Jul 01 1983 00:00:00 GMT+0200 (Paris, Madrid (heure d’été)) Suisse Bâle? Fribourg?  Treyvaux? Genève ?   à identifier  Travaux des champs + stage en montagne neige... travaux construction+ travaux de ferme +++ 1983 juillet : 1, 1A : Timothée Wuillemin  1983 juillet : 2A – 4A : Heinz Wuillemin  1983 juillet : 5A : Olivier Wuillemin, Heinz Wuillemin  1983 juillet : 6A – 14A : Heinz Wuillemin  1983 juillet : 15A : Heinz Wuillemin, Zacharie Wuillemin  1983 juillet : 16A – 27A : Heinz Wuillemin   --- ANB_ Wed May 25 2011 00:00:00 GMT+0200 (Paris, Madrid (heure d’été)) PS"},{"index":{"_index":"phototheque","_type":"phototheque","_id":"_9834079"}},{"id":476,"indexCIJW":"PH0292001059","dossier":"0292","sousdossier":"001","document":"059","lien":"y","photographe":"Luc PRISSET","agence":"ATD Quart-Monde","droit_auteur":"PHOATD","droit_image":"TACITE","contenu":"Fond L.P. SUISSE 1983   N+C","temoin_ref":"Erika Forney","date":"1983-06-30T22:00:00.000Z","lieu":"Suisse","description":"Bâle? Fribourg?  Treyvaux? Genève ?   à identifier  Travaux des champs + stage en montagne neige... travaux construction+ travaux de ferme +++ 1983 juillet : 1 – 37 : Heinz Wuillemin, travail sur l’alpage","local":"---","support":"ANB_","dateMaj":"2011-05-24T22:00:00.000Z","redacteur":"PS","content":" 476 PH0292001059 0292 001 059 y Luc PRISSET ATD Quart-Monde PHOATD TACITE Fond L.P. SUISSE 1983   N+C Erika Forney Fri Jul 01 1983 00:00:00 GMT+0200 (Paris, Madrid (heure d’été)) Suisse Bâle? Fribourg?  Treyvaux? Genève ?   à identifier  Travaux des champs + stage en montagne neige... travaux construction+ travaux de ferme +++ 1983 juillet : 1 – 37 : Heinz Wuillemin, travail sur l’alpage --- ANB_ Wed May 25 2011 00:00:00 GMT+0200 (Paris, Madrid (heure d’été)) PS"},{"index":{"_index":"phototheque","_type":"phototheque","_id":"_9834080"}},{"id":477,"indexCIJW":"PH0292001060","dossier":"0292","sousdossier":"001","document":"060","lien":"y","photographe":"Luc PRISSET","agence":"ATD Quart-Monde","droit_auteur":"PHOATD","droit_image":"TACITE","contenu":"Fond L.P. SUISSE 1983   N+C","temoin_ref":"Erika Forney","date":"1983-06-30T22:00:00.000Z","lieu":"Suisse","description":"Bâle? Fribourg?  Treyvaux? Genève ?   à identifier  Travaux des champs + stage en montagne neige... travaux construction+ travaux de ferme +++ 1983 juillet : 42A, 1 – 37 : Heinz Wuillemin, repas à l’alpage  ","local":"---","support":"ANB_","dateMaj":"2011-05-24T22:00:00.000Z","redacteur":"PS","content":" 477 PH0292001060 0292 001 060 y Luc PRISSET ATD Quart-Monde PHOATD TACITE Fond L.P. SUISSE 1983   N+C Erika Forney Fri Jul 01 1983 00:00:00 GMT+0200 (Paris, Madrid (heure d’été)) Suisse Bâle? Fribourg?  Treyvaux? Genève ?   à identifier  Travaux des champs + stage en montagne neige... travaux construction+ travaux de ferme +++ 1983 juillet : 42A, 1 – 37 : Heinz Wuillemin, repas à l’alpage   --- ANB_ Wed May 25 2011 00:00:00 GMT+0200 (Paris, Madrid (heure d’été)) PS"},{"index":{"_index":"phototheque","_type":"phototheque","_id":"_9834081"}},{"id":478,"indexCIJW":"PH0292001061","dossier":"0292","sousdossier":"001","document":"061","lien":"y","photographe":"Luc PRISSET","agence":"ATD Quart-Monde","droit_auteur":"PHOATD","droit_image":"TACITE","contenu":"Fond L.P. SUISSE 1983   N+C","temoin_ref":"Erika Forney","date":"1983-06-30T22:00:00.000Z","lieu":"Suisse","description":"Bâle? Fribourg?  Treyvaux? Genève ?   à identifier  Travaux des champs + stage en montagne neige... travaux construction+ travaux de ferme +++ 1983 juillet : 42A, 1 – 13 : Heinz Wuillemin  1983 juillet : 15A – 17A : Heinz Wuillemin, Otto Raetzo  1983 juillet : 18A : Gérald Schmutz, Anne-Claire Brand  1983 juillet : 19A – 22A : Otto Raetzo, Heinz Wuillemin  1983 juillet : 23A – 28A : Heinz Wuillemin  1983 juillet : 29A : Marianne Schmutz  1983 juillet : 30A, 31A :Evelyne et Gérald Schmutz,??, Anne-Claire Brand  1983 juillet : 32A : Heinz Wuillemin, Mariane Schmutz  1983 juillet : 33A : Marianne Schmutz et sa fille Evelyne1983 juillet : 35A – 37A : Heinz Wuillemin    ","local":"---","support":"ANB_","dateMaj":"2011-05-24T22:00:00.000Z","redacteur":"PS","content":" 478 PH0292001061 0292 001 061 y Luc PRISSET ATD Quart-Monde PHOATD TACITE Fond L.P. SUISSE 1983   N+C Erika Forney Fri Jul 01 1983 00:00:00 GMT+0200 (Paris, Madrid (heure d’été)) Suisse Bâle? Fribourg?  Treyvaux? Genève ?   à identifier  Travaux des champs + stage en montagne neige... travaux construction+ travaux de ferme +++ 1983 juillet : 42A, 1 – 13 : Heinz Wuillemin  1983 juillet : 15A – 17A : Heinz Wuillemin, Otto Raetzo  1983 juillet : 18A : Gérald Schmutz, Anne-Claire Brand  1983 juillet : 19A – 22A : Otto Raetzo, Heinz Wuillemin  1983 juillet : 23A – 28A : Heinz Wuillemin  1983 juillet : 29A : Marianne Schmutz  1983 juillet : 30A, 31A :Evelyne et Gérald Schmutz,??, Anne-Claire Brand  1983 juillet : 32A : Heinz Wuillemin, Mariane Schmutz  1983 juillet : 33A : Marianne Schmutz et sa fille Evelyne1983 juillet : 35A – 37A : Heinz Wuillemin     --- ANB_ Wed May 25 2011 00:00:00 GMT+0200 (Paris, Madrid (heure d’été)) PS"},{"index":{"_index":"phototheque","_type":"phototheque","_id":"_9834082"}},{"id":479,"indexCIJW":"PH0292001062","dossier":"0292","sousdossier":"001","document":"062","lien":"y","photographe":"Luc PRISSET","agence":"ATD Quart-Monde","droit_auteur":"PHOATD","droit_image":"TACITE","contenu":"Fond L.P. SUISSE 1983   N+C","temoin_ref":"Erika Forney","date":"1983-06-30T22:00:00.000Z","lieu":"Suisse","description":"Bâle? Fribourg?  Treyvaux? Genève ?   à identifier  Travaux des champs + stage en montagne neige... travaux construction+ travaux de ferme +++ 1983 juillet : 42A, 1 – 36 : Heinz Wuillemin  1983 juillet : 37 : Heinz Wuillemin, Evelyne et Marianne Schmutz, Otto Raetzo, Anne-Claire Brand  ","local":"---","support":"ANB_","dateMaj":"2011-05-24T22:00:00.000Z","redacteur":"PS","content":" 479 PH0292001062 0292 001 062 y Luc PRISSET ATD Quart-Monde PHOATD TACITE Fond L.P. SUISSE 1983   N+C Erika Forney Fri Jul 01 1983 00:00:00 GMT+0200 (Paris, Madrid (heure d’été)) Suisse Bâle? Fribourg?  Treyvaux? Genève ?   à identifier  Travaux des champs + stage en montagne neige... travaux construction+ travaux de ferme +++ 1983 juillet : 42A, 1 – 36 : Heinz Wuillemin  1983 juillet : 37 : Heinz Wuillemin, Evelyne et Marianne Schmutz, Otto Raetzo, Anne-Claire Brand   --- ANB_ Wed May 25 2011 00:00:00 GMT+0200 (Paris, Madrid (heure d’été)) PS"},{"index":{"_index":"phototheque","_type":"phototheque","_id":"_9834083"}},{"id":480,"indexCIJW":"PH0292001063","dossier":"0292","sousdossier":"001","document":"063","lien":"y","photographe":"Luc PRISSET","agence":"ATD Quart-Monde","droit_auteur":"PHOATD","droit_image":"TACITE","contenu":"Fond L.P. SUISSE 1983   N+C","temoin_ref":"Erika Forney","date":"1983-06-30T22:00:00.000Z","lieu":"Suisse","description":"Bâle? Fribourg?  Treyvaux? Genève ?   à identifier  Travaux des champs + stage en montagne neige... travaux construction+ travaux de ferme +++ 1983 juillet : 42, 1, 1A : Marianne Schmutz  1983 juillet : 2 : Gérald Schmutz  1983 juillet : 3 : ??  1983 juillet : 4, 5 : Anne-Claire Brand  1983 juillet : 6 – 10 : Gérald Schmutz  1983 juillet : 11, 12 : Evelyne Schmutz  1983 juillet : 14 – 17 : Marianne Schmutz  1983 juillet : 18 – 20 : Gérald Schmutz  1983 juillet : 21 – 37 : bibliothèque de rue au Vieux Chêne (Fribourg)  ","local":"---","support":"ANB_","dateMaj":"2011-05-24T22:00:00.000Z","redacteur":"PS","content":" 480 PH0292001063 0292 001 063 y Luc PRISSET ATD Quart-Monde PHOATD TACITE Fond L.P. SUISSE 1983   N+C Erika Forney Fri Jul 01 1983 00:00:00 GMT+0200 (Paris, Madrid (heure d’été)) Suisse Bâle? Fribourg?  Treyvaux? Genève ?   à identifier  Travaux des champs + stage en montagne neige... travaux construction+ travaux de ferme +++ 1983 juillet : 42, 1, 1A : Marianne Schmutz  1983 juillet : 2 : Gérald Schmutz  1983 juillet : 3 : ??  1983 juillet : 4, 5 : Anne-Claire Brand  1983 juillet : 6 – 10 : Gérald Schmutz  1983 juillet : 11, 12 : Evelyne Schmutz  1983 juillet : 14 – 17 : Marianne Schmutz  1983 juillet : 18 – 20 : Gérald Schmutz  1983 juillet : 21 – 37 : bibliothèque de rue au Vieux Chêne (Fribourg)   --- ANB_ Wed May 25 2011 00:00:00 GMT+0200 (Paris, Madrid (heure d’été)) PS"},{"index":{"_index":"phototheque","_type":"phototheque","_id":"_9834084"}},{"id":481,"indexCIJW":"PH0292001064","dossier":"0292","sousdossier":"001","document":"064","lien":"y","photographe":"Luc PRISSET","agence":"ATD Quart-Monde","droit_auteur":"PHOATD","droit_image":"TACITE","contenu":"Fond L.P. SUISSE 1983   N+C","temoin_ref":"Erika Forney","date":"1983-06-30T22:00:00.000Z","lieu":"Suisse","description":"Bâle? Fribourg?  Treyvaux? Genève ?   à identifier  Travaux des champs + stage en montagne neige... travaux construction+ travaux de ferme +++ 1983 juillet : 34A : Heinzne Schmutz Wuillemin, Marianne Schmutz 1983 juillet : 17 : Anne-Claire Brand  1983 juillet : 21 : famille Heinz Ritter, Annelies Wuillemin  1983 juillet : 22 : Paul King  1983 juillet : 23 : famille Heinz Ritter, Annelies Wuillemin  1983 juillet : 24 : compagne Heinz Ritter, Annelies Wuillemin  1983 juillet : 25, 26 : Annelies Wuillemin, Heinz Ritter  1983 juillet : 31 – 33 : famille Heinz Ritter  1983 juillet : 34 : Georges Sierro  1983 juillet : 37 : Heinz Ritter et enfant  1983 juillet : 38 : Annelies Wuillemin, ?? et enfant  ","local":"---","support":"ANB_","dateMaj":"2011-05-24T22:00:00.000Z","redacteur":"PS","content":" 481 PH0292001064 0292 001 064 y Luc PRISSET ATD Quart-Monde PHOATD TACITE Fond L.P. SUISSE 1983   N+C Erika Forney Fri Jul 01 1983 00:00:00 GMT+0200 (Paris, Madrid (heure d’été)) Suisse Bâle? Fribourg?  Treyvaux? Genève ?   à identifier  Travaux des champs + stage en montagne neige... travaux construction+ travaux de ferme +++ 1983 juillet : 34A : Heinzne Schmutz Wuillemin, Marianne Schmutz 1983 juillet : 17 : Anne-Claire Brand  1983 juillet : 21 : famille Heinz Ritter, Annelies Wuillemin  1983 juillet : 22 : Paul King  1983 juillet : 23 : famille Heinz Ritter, Annelies Wuillemin  1983 juillet : 24 : compagne Heinz Ritter, Annelies Wuillemin  1983 juillet : 25, 26 : Annelies Wuillemin, Heinz Ritter  1983 juillet : 31 – 33 : famille Heinz Ritter  1983 juillet : 34 : Georges Sierro  1983 juillet : 37 : Heinz Ritter et enfant  1983 juillet : 38 : Annelies Wuillemin, ?? et enfant   --- ANB_ Wed May 25 2011 00:00:00 GMT+0200 (Paris, Madrid (heure d’été)) PS"},{"index":{"_index":"phototheque","_type":"phototheque","_id":"_9834085"}},{"id":482,"indexCIJW":"PH0292001065","dossier":"0292","sousdossier":"001","document":"065","lien":"y","photographe":"Luc PRISSET","agence":"ATD Quart-Monde","droit_auteur":"PHOATD","droit_image":"TACITE","contenu":"Fond L.P. SUISSE 1983   N+C","temoin_ref":"Erika Forney","date":"1983-06-30T22:00:00.000Z","lieu":"Suisse","description":"Bâle? Fribourg?  Treyvaux? Genève ?   à identifier  Travaux des champs + stage en montagne neige... travaux construction+ travaux de ferme +++ 1983 juillet : 42A, 1 – 38 : activités et bibliothèque de rue au Vieux Chêne, Fribourg ","local":"---","support":"ANB_","dateMaj":"2011-05-24T22:00:00.000Z","redacteur":"PS","content":" 482 PH0292001065 0292 001 065 y Luc PRISSET ATD Quart-Monde PHOATD TACITE Fond L.P. SUISSE 1983   N+C Erika Forney Fri Jul 01 1983 00:00:00 GMT+0200 (Paris, Madrid (heure d’été)) Suisse Bâle? Fribourg?  Treyvaux? Genève ?   à identifier  Travaux des champs + stage en montagne neige... travaux construction+ travaux de ferme +++ 1983 juillet : 42A, 1 – 38 : activités et bibliothèque de rue au Vieux Chêne, Fribourg  --- ANB_ Wed May 25 2011 00:00:00 GMT+0200 (Paris, Madrid (heure d’été)) PS"},{"index":{"_index":"phototheque","_type":"phototheque","_id":"_9834086"}},{"id":483,"indexCIJW":"PH0292001066","dossier":"0292","sousdossier":"001","document":"066","lien":"y","photographe":"Luc PRISSET","agence":"ATD Quart-Monde","droit_auteur":"PHOATD","droit_image":"TACITE","contenu":"Fond L.P. SUISSE 1983   N+C","temoin_ref":"Erika Forney","date":"1983-06-30T22:00:00.000Z","lieu":"Suisse","description":"Bâle? Fribourg?  Treyvaux? Genève ?   à identifier  Travaux des champs + stage en montagne neige... travaux construction+ travaux de ferme +++ 1983 juillet : 1 – 33 : bibliothèque de rue au Vieux Chêne, Fribourg  ","local":"---","support":"ANB_","dateMaj":"2011-05-24T22:00:00.000Z","redacteur":"PS","content":" 483 PH0292001066 0292 001 066 y Luc PRISSET ATD Quart-Monde PHOATD TACITE Fond L.P. SUISSE 1983   N+C Erika Forney Fri Jul 01 1983 00:00:00 GMT+0200 (Paris, Madrid (heure d’été)) Suisse Bâle? Fribourg?  Treyvaux? Genève ?   à identifier  Travaux des champs + stage en montagne neige... travaux construction+ travaux de ferme +++ 1983 juillet : 1 – 33 : bibliothèque de rue au Vieux Chêne, Fribourg   --- ANB_ Wed May 25 2011 00:00:00 GMT+0200 (Paris, Madrid (heure d’été)) PS"},{"index":{"_index":"phototheque","_type":"phototheque","_id":"_9834087"}},{"id":484,"indexCIJW":"PH0292001067","dossier":"0292","sousdossier":"001","document":"067","lien":"y","photographe":"Luc PRISSET","agence":"ATD Quart-Monde","droit_auteur":"PHOATD","droit_image":"TACITE","contenu":"Fond L.P. SUISSE 1983   N+C","temoin_ref":"Erika Forney","date":"1983-06-30T22:00:00.000Z","lieu":"Suisse","description":"Bâle? Fribourg?  Treyvaux? Genève ?   à identifier  Travaux des champs + stage en montagne neige... travaux construction+ travaux de ferme ++++ 1983 juillet : 1 – 10 : Gérald Schmutz ( ??)  1983 juillet : 20 : Gérald Schmutz  1983 juillet : 25 - 37  ","local":"---","support":"ANB_","dateMaj":"2011-05-24T22:00:00.000Z","redacteur":"PS","content":" 484 PH0292001067 0292 001 067 y Luc PRISSET ATD Quart-Monde PHOATD TACITE Fond L.P. SUISSE 1983   N+C Erika Forney Fri Jul 01 1983 00:00:00 GMT+0200 (Paris, Madrid (heure d’été)) Suisse Bâle? Fribourg?  Treyvaux? Genève ?   à identifier  Travaux des champs + stage en montagne neige... travaux construction+ travaux de ferme ++++ 1983 juillet : 1 – 10 : Gérald Schmutz ( ??)  1983 juillet : 20 : Gérald Schmutz  1983 juillet : 25 - 37   --- ANB_ Wed May 25 2011 00:00:00 GMT+0200 (Paris, Madrid (heure d’été)) PS"},{"index":{"_index":"phototheque","_type":"phototheque","_id":"_9834088"}},{"id":485,"indexCIJW":"PH0292001068","dossier":"0292","sousdossier":"001","document":"068","lien":"y","photographe":"Luc PRISSET","agence":"ATD Quart-Monde","droit_auteur":"PHOATD","droit_image":"TACITE","contenu":"Fond L.P. SUISSE 1983   N+C","temoin_ref":"Erika Forney","date":"1983-06-30T22:00:00.000Z","lieu":"Suisse","description":"Bâle? Fribourg?  Treyvaux? Genève ?   à identifier  Travaux des champs + stage en montagne neige... travaux construction+ travaux de ferme +++ 1983 juillet : 1 – 29 :   1983 juillet : 30 – 37 : fils Barras, …  ","local":"---","support":"ANB_","dateMaj":"2011-05-24T22:00:00.000Z","redacteur":"PS","content":" 485 PH0292001068 0292 001 068 y Luc PRISSET ATD Quart-Monde PHOATD TACITE Fond L.P. SUISSE 1983   N+C Erika Forney Fri Jul 01 1983 00:00:00 GMT+0200 (Paris, Madrid (heure d’été)) Suisse Bâle? Fribourg?  Treyvaux? Genève ?   à identifier  Travaux des champs + stage en montagne neige... travaux construction+ travaux de ferme +++ 1983 juillet : 1 – 29 :   1983 juillet : 30 – 37 : fils Barras, …   --- ANB_ Wed May 25 2011 00:00:00 GMT+0200 (Paris, Madrid (heure d’été)) PS"},{"index":{"_index":"phototheque","_type":"phototheque","_id":"_9834089"}},{"id":486,"indexCIJW":"PH0292001069","dossier":"0292","sousdossier":"001","document":"069","lien":"y","photographe":"Luc PRISSET","agence":"ATD Quart-Monde","droit_auteur":"PHOATD","droit_image":"TACITE","contenu":"Fond L.P. SUISSE 1983   N+C","temoin_ref":"Erika Forney","date":"1983-06-30T22:00:00.000Z","lieu":"Suisse","description":"Bâle? Fribourg?  Treyvaux? Genève ?   à identifier  Travaux des champs + stage en montagne neige... travaux construction+ travaux de ferme +++ 1983 juillet : 42A, 1 – 6 : vacances familiales, Treyvaux  1983 juillet : 7 – 14 : fils Barras  1983 juillet : 15 – 20 : Madame Mathilde Barras  1983 juillet : 21 – 38 : fils Barras, ferraille (récupération)  ","local":"---","support":"ANB_","dateMaj":"2011-05-24T22:00:00.000Z","redacteur":"PS","content":" 486 PH0292001069 0292 001 069 y Luc PRISSET ATD Quart-Monde PHOATD TACITE Fond L.P. SUISSE 1983   N+C Erika Forney Fri Jul 01 1983 00:00:00 GMT+0200 (Paris, Madrid (heure d’été)) Suisse Bâle? Fribourg?  Treyvaux? Genève ?   à identifier  Travaux des champs + stage en montagne neige... travaux construction+ travaux de ferme +++ 1983 juillet : 42A, 1 – 6 : vacances familiales, Treyvaux  1983 juillet : 7 – 14 : fils Barras  1983 juillet : 15 – 20 : Madame Mathilde Barras  1983 juillet : 21 – 38 : fils Barras, ferraille (récupération)   --- ANB_ Wed May 25 2011 00:00:00 GMT+0200 (Paris, Madrid (heure d’été)) PS"},{"index":{"_index":"phototheque","_type":"phototheque","_id":"_9834090"}},{"id":487,"indexCIJW":"PH0292001070","dossier":"0292","sousdossier":"001","document":"070","lien":"y","photographe":"Luc PRISSET","agence":"ATD Quart-Monde","droit_auteur":"PHOATD","droit_image":"TACITE","contenu":"Fond L.P. SUISSE 1983   N+C","temoin_ref":"Erika Forney","date":"1983-06-30T22:00:00.000Z","lieu":"Suisse","description":"Bâle? Fribourg?  Treyvaux? Genève ?   à identifier  Travaux des champs + stage en montagne neige... travaux construction+ travaux de ferme +++ 1983 juillet : 42A, 1 – 6A : activités au Vieux Chêne, Fribourg  1983 juillet : 7A – 10A : Gérald Schmutz  1983 juillet : 11A – 37A : fils Barras, ferraille  ","local":"---","support":"ANB_","dateMaj":"2011-05-24T22:00:00.000Z","redacteur":"PS","content":" 487 PH0292001070 0292 001 070 y Luc PRISSET ATD Quart-Monde PHOATD TACITE Fond L.P. SUISSE 1983   N+C Erika Forney Fri Jul 01 1983 00:00:00 GMT+0200 (Paris, Madrid (heure d’été)) Suisse Bâle? Fribourg?  Treyvaux? Genève ?   à identifier  Travaux des champs + stage en montagne neige... travaux construction+ travaux de ferme +++ 1983 juillet : 42A, 1 – 6A : activités au Vieux Chêne, Fribourg  1983 juillet : 7A – 10A : Gérald Schmutz  1983 juillet : 11A – 37A : fils Barras, ferraille   --- ANB_ Wed May 25 2011 00:00:00 GMT+0200 (Paris, Madrid (heure d’été)) PS"},{"index":{"_index":"phototheque","_type":"phototheque","_id":"_9834091"}},{"id":488,"indexCIJW":"PH0292001071","dossier":"0292","sousdossier":"001","document":"071","lien":"y","photographe":"Luc PRISSET","agence":"ATD Quart-Monde","droit_auteur":"PHOATD","droit_image":"TACITE","contenu":"Fond L.P. SUISSE 1983   N+C","temoin_ref":"Erika Forney","date":"1983-06-30T22:00:00.000Z","lieu":"Suisse","description":"Bâle? Fribourg?  Treyvaux? Genève ?   à identifier  Travaux des champs + stage en montagne neige... travaux construction+ travaux de ferme +++ 1983 juillet : 1 – 21 : fils Barras  1983 juillet : 22 – 27 : Madame Mathilde Barras et son fils  1983 juillet : 28 – 37 : fils Barras (ferraille)  ","local":"---","support":"ANB_","dateMaj":"2011-05-24T22:00:00.000Z","redacteur":"PS","content":" 488 PH0292001071 0292 001 071 y Luc PRISSET ATD Quart-Monde PHOATD TACITE Fond L.P. SUISSE 1983   N+C Erika Forney Fri Jul 01 1983 00:00:00 GMT+0200 (Paris, Madrid (heure d’été)) Suisse Bâle? Fribourg?  Treyvaux? Genève ?   à identifier  Travaux des champs + stage en montagne neige... travaux construction+ travaux de ferme +++ 1983 juillet : 1 – 21 : fils Barras  1983 juillet : 22 – 27 : Madame Mathilde Barras et son fils  1983 juillet : 28 – 37 : fils Barras (ferraille)   --- ANB_ Wed May 25 2011 00:00:00 GMT+0200 (Paris, Madrid (heure d’été)) PS"},{"index":{"_index":"phototheque","_type":"phototheque","_id":"_9834092"}},{"id":489,"indexCIJW":"PH0292001072","dossier":"0292","sousdossier":"001","document":"072","lien":"y","photographe":"Luc PRISSET","agence":"ATD Quart-Monde","droit_auteur":"PHOATD","droit_image":"TACITE","contenu":"Fond L.P. SUISSE 1983   N+C","temoin_ref":"Erika Forney","date":"1983-06-30T22:00:00.000Z","lieu":"Suisse","description":"Bâle? Fribourg?  Treyvaux? Genève ?   à identifier  Travaux des champs + stage en montagne neige... travaux construction+ travaux de ferme +++ 1983 juillet : 42A – 5A : fils Barras (ferraille)  1983 juillet : 6A – 25A : Madame Mathilde Barras et son fils  1983 juillet : 27 – 29 : Madame Mathilde Barras  1983 juillet : 30 – 37 : fils Barras  ","local":"---","support":"ANB_","dateMaj":"2011-05-24T22:00:00.000Z","redacteur":"PS","content":" 489 PH0292001072 0292 001 072 y Luc PRISSET ATD Quart-Monde PHOATD TACITE Fond L.P. SUISSE 1983   N+C Erika Forney Fri Jul 01 1983 00:00:00 GMT+0200 (Paris, Madrid (heure d’été)) Suisse Bâle? Fribourg?  Treyvaux? Genève ?   à identifier  Travaux des champs + stage en montagne neige... travaux construction+ travaux de ferme +++ 1983 juillet : 42A – 5A : fils Barras (ferraille)  1983 juillet : 6A – 25A : Madame Mathilde Barras et son fils  1983 juillet : 27 – 29 : Madame Mathilde Barras  1983 juillet : 30 – 37 : fils Barras   --- ANB_ Wed May 25 2011 00:00:00 GMT+0200 (Paris, Madrid (heure d’été)) PS"},{"index":{"_index":"phototheque","_type":"phototheque","_id":"_9834093"}},{"id":490,"indexCIJW":"PH0292001073","dossier":"0292","sousdossier":"001","document":"073","lien":"y","photographe":"Luc PRISSET","agence":"ATD Quart-Monde","droit_auteur":"PHOATD","droit_image":"TACITE","contenu":"Fond L.P. SUISSE 1983   N+C","temoin_ref":"Erika Forney","date":"1983-06-30T22:00:00.000Z","lieu":"Suisse","description":"Bâle? Fribourg?  Treyvaux? Genève ?   à identifier  Travaux des champs + stage en montagne neige... travaux construction+ travaux de ferme +++ 1983 juillet : 42A, 1 – 26A : fils Barras  1983 juillet : 22A : Madame Mathilde Barras et son fils  1983 juillet : 23A : fils Barras  1983 juillet : 24A – 30A : Madame Mathilde Barras et son fils  1983 juillet : 31A – 27A : fils Barras  ","local":"---","support":"ANB_","dateMaj":"2011-05-24T22:00:00.000Z","redacteur":"PS","content":" 490 PH0292001073 0292 001 073 y Luc PRISSET ATD Quart-Monde PHOATD TACITE Fond L.P. SUISSE 1983   N+C Erika Forney Fri Jul 01 1983 00:00:00 GMT+0200 (Paris, Madrid (heure d’été)) Suisse Bâle? Fribourg?  Treyvaux? Genève ?   à identifier  Travaux des champs + stage en montagne neige... travaux construction+ travaux de ferme +++ 1983 juillet : 42A, 1 – 26A : fils Barras  1983 juillet : 22A : Madame Mathilde Barras et son fils  1983 juillet : 23A : fils Barras  1983 juillet : 24A – 30A : Madame Mathilde Barras et son fils  1983 juillet : 31A – 27A : fils Barras   --- ANB_ Wed May 25 2011 00:00:00 GMT+0200 (Paris, Madrid (heure d’été)) PS"},{"index":{"_index":"phototheque","_type":"phototheque","_id":"_9834094"}},{"id":491,"indexCIJW":"PH0292001074","dossier":"0292","sousdossier":"001","document":"074","lien":"y","photographe":"Luc PRISSET","agence":"ATD Quart-Monde","droit_auteur":"PHOATD","droit_image":"TACITE","contenu":"Fond L.P. SUISSE 1983   N+C","temoin_ref":"Erika Forney","date":"1983-06-30T22:00:00.000Z","lieu":"Suisse","description":"Bâle? Fribourg?  Treyvaux? Genève ?   à identifier  Travaux des champs + stage en montagne neige... travaux construction+ travaux de ferme +++ 1983 juillet : 42A, 1 – 37 : fils Barras (ferrailleurs)  ","local":"---","support":"ANB_","dateMaj":"2011-05-24T22:00:00.000Z","redacteur":"PS","content":" 491 PH0292001074 0292 001 074 y Luc PRISSET ATD Quart-Monde PHOATD TACITE Fond L.P. SUISSE 1983   N+C Erika Forney Fri Jul 01 1983 00:00:00 GMT+0200 (Paris, Madrid (heure d’été)) Suisse Bâle? Fribourg?  Treyvaux? Genève ?   à identifier  Travaux des champs + stage en montagne neige... travaux construction+ travaux de ferme +++ 1983 juillet : 42A, 1 – 37 : fils Barras (ferrailleurs)   --- ANB_ Wed May 25 2011 00:00:00 GMT+0200 (Paris, Madrid (heure d’été)) PS"},{"index":{"_index":"phototheque","_type":"phototheque","_id":"_9834095"}},{"id":492,"indexCIJW":"PH0292001075","dossier":"0292","sousdossier":"001","document":"075","lien":"y","photographe":"Luc PRISSET","agence":"ATD Quart-Monde","droit_auteur":"PHOATD","droit_image":"TACITE","contenu":"Fond L.P. SUISSE 1983   N+C","temoin_ref":"Erika Forney","date":"1983-06-30T22:00:00.000Z","lieu":"Suisse","description":"Bâle? Fribourg?  Treyvaux? Genève ?   à identifier  Travaux des champs + stage en montagne neige... travaux construction+ travaux de ferme +++ 1983 juillet : 42A, 1 – 38 : fils Barras (ferrailleurs)  ","local":"---","support":"ANB_","dateMaj":"2011-05-24T22:00:00.000Z","redacteur":"PS","content":" 492 PH0292001075 0292 001 075 y Luc PRISSET ATD Quart-Monde PHOATD TACITE Fond L.P. SUISSE 1983   N+C Erika Forney Fri Jul 01 1983 00:00:00 GMT+0200 (Paris, Madrid (heure d’été)) Suisse Bâle? Fribourg?  Treyvaux? Genève ?   à identifier  Travaux des champs + stage en montagne neige... travaux construction+ travaux de ferme +++ 1983 juillet : 42A, 1 – 38 : fils Barras (ferrailleurs)   --- ANB_ Wed May 25 2011 00:00:00 GMT+0200 (Paris, Madrid (heure d’été)) PS"},{"index":{"_index":"phototheque","_type":"phototheque","_id":"_9834096"}},{"id":493,"indexCIJW":"PH0292001076","dossier":"0292","sousdossier":"001","document":"076","lien":"y","photographe":"Luc PRISSET","agence":"ATD Quart-Monde","droit_auteur":"PHOATD","droit_image":"TACITE","contenu":"Fond L.P. SUISSE 1983   N+C","temoin_ref":"Erika Forney","date":"1983-06-30T22:00:00.000Z","lieu":"Suisse","description":"Bâle? Fribourg?  Treyvaux? Genève ?   à identifier  Travaux des champs + stage en montagne neige... travaux construction+ travaux de ferme +++ 1983 juillet : 42A, 1 – 31 : fils Barras (ferraileurs)  1983 juillet : 32 – 37 : Madame Mathilde Barras et fils  ","local":"---","support":"ANB_","dateMaj":"2011-05-24T22:00:00.000Z","redacteur":"PS","content":" 493 PH0292001076 0292 001 076 y Luc PRISSET ATD Quart-Monde PHOATD TACITE Fond L.P. SUISSE 1983   N+C Erika Forney Fri Jul 01 1983 00:00:00 GMT+0200 (Paris, Madrid (heure d’été)) Suisse Bâle? Fribourg?  Treyvaux? Genève ?   à identifier  Travaux des champs + stage en montagne neige... travaux construction+ travaux de ferme +++ 1983 juillet : 42A, 1 – 31 : fils Barras (ferraileurs)  1983 juillet : 32 – 37 : Madame Mathilde Barras et fils   --- ANB_ Wed May 25 2011 00:00:00 GMT+0200 (Paris, Madrid (heure d’été)) PS"},{"index":{"_index":"phototheque","_type":"phototheque","_id":"_9834097"}},{"id":494,"indexCIJW":"PH0292001077","dossier":"0292","sousdossier":"001","document":"077","lien":"y","photographe":"Luc PRISSET","agence":"ATD Quart-Monde","droit_auteur":"PHOATD","droit_image":"TACITE","contenu":"Fond L.P. SUISSE 1983   N+C","temoin_ref":"Erika Forney","date":"1983-06-30T22:00:00.000Z","lieu":"Suisse","description":"Bâle? Fribourg?  Treyvaux? Genève ?   à identifier  Travaux des champs + stage en montagne neige... travaux construction+ travaux de ferme +++ 1983 juillet : 7 – 17 : Madame Mathilde Barras et fils  1983 juillet : 18 – 38 : 2 fils de Madame Barras  ","local":"---","support":"ANB_","dateMaj":"2011-05-24T22:00:00.000Z","redacteur":"PS","content":" 494 PH0292001077 0292 001 077 y Luc PRISSET ATD Quart-Monde PHOATD TACITE Fond L.P. SUISSE 1983   N+C Erika Forney Fri Jul 01 1983 00:00:00 GMT+0200 (Paris, Madrid (heure d’été)) Suisse Bâle? Fribourg?  Treyvaux? Genève ?   à identifier  Travaux des champs + stage en montagne neige... travaux construction+ travaux de ferme +++ 1983 juillet : 7 – 17 : Madame Mathilde Barras et fils  1983 juillet : 18 – 38 : 2 fils de Madame Barras   --- ANB_ Wed May 25 2011 00:00:00 GMT+0200 (Paris, Madrid (heure d’été)) PS"},{"index":{"_index":"phototheque","_type":"phototheque","_id":"_9834098"}},{"id":495,"indexCIJW":"PH0292001078","dossier":"0292","sousdossier":"001","document":"078","lien":"y","photographe":"Luc PRISSET","agence":"ATD Quart-Monde","droit_auteur":"PHOATD","droit_image":"TACITE","contenu":"Fond L.P. SUISSE 1983   N+C","temoin_ref":"Erika Forney","date":"1983-06-30T22:00:00.000Z","lieu":"Suisse","description":"Bâle? Fribourg?  Treyvaux? Genève ?   à identifier  Travaux des champs + stage en montagne neige... travaux construction+ travaux de ferme +++ 1983 juillet : 42A, 1 – 8 : fils de Madame Barras  ","local":"---","support":"ANB_","dateMaj":"2011-05-24T22:00:00.000Z","redacteur":"PS","content":" 495 PH0292001078 0292 001 078 y Luc PRISSET ATD Quart-Monde PHOATD TACITE Fond L.P. SUISSE 1983   N+C Erika Forney Fri Jul 01 1983 00:00:00 GMT+0200 (Paris, Madrid (heure d’été)) Suisse Bâle? Fribourg?  Treyvaux? Genève ?   à identifier  Travaux des champs + stage en montagne neige... travaux construction+ travaux de ferme +++ 1983 juillet : 42A, 1 – 8 : fils de Madame Barras   --- ANB_ Wed May 25 2011 00:00:00 GMT+0200 (Paris, Madrid (heure d’été)) PS"},{"index":{"_index":"phototheque","_type":"phototheque","_id":"_9834099"}},{"id":496,"indexCIJW":"PH0292001079","dossier":"0292","sousdossier":"001","document":"079","lien":"y","photographe":"Luc PRISSET","agence":"ATD Quart-Monde","droit_auteur":"PHOATD","droit_image":"TACITE","contenu":"Fond L.P. SUISSE 1983   N+C","temoin_ref":"Erika Forney","date":"1983-06-30T22:00:00.000Z","lieu":"Suisse","description":"Bâle? Fribourg?  Treyvaux? Genève ?   à identifier  Travaux des champs + stage en montagne neige... travaux construction+ travaux de ferme ","local":"---","support":"ANB_","dateMaj":"2011-05-24T22:00:00.000Z","redacteur":"PS","content":" 496 PH0292001079 0292 001 079 y Luc PRISSET ATD Quart-Monde PHOATD TACITE Fond L.P. SUISSE 1983   N+C Erika Forney Fri Jul 01 1983 00:00:00 GMT+0200 (Paris, Madrid (heure d’été)) Suisse Bâle? Fribourg?  Treyvaux? Genève ?   à identifier  Travaux des champs + stage en montagne neige... travaux construction+ travaux de ferme  --- ANB_ Wed May 25 2011 00:00:00 GMT+0200 (Paris, Madrid (heure d’été)) PS"}]